created at,text,name,screen name,location,verified,followers count,friends count,retweet count,favorite count
2020-10-06 07:44:34,"b'Second in an ongoing series, this article dives into the co-existence of the #blockchain with the proposed Indian d\\u2026 https://t.co/GlBgHxmPY2'",YourStory,YourStoryCo,India,True,247929,937,3,4
2020-10-06 07:40:34,b'Consumers? Engineers? Policy makers? Who should make data privacy more rational? https://t.co/IIMC0DFYW1\\u2026 https://t.co/qr0ufNFsIi',VigiSec Solutions,vigisec,Karachi,False,136,106,0,1
2020-10-06 07:40:05,"b'Russian authorities are planning to expand the use of CCTV cameras with facial recognition software, despite weight\\u2026 https://t.co/IXkh9qmIYu'",IFEX,IFEX,,True,37656,1477,5,5
2020-10-06 07:32:05,b'@hm fined record \\u20ac35 million in #Germany #Nuremberg for illegal surveillance of private lives of employees since 20\\u2026 https://t.co/uI2TS4zwUS',Artist of Kouroo,ArtistOfKouroo,"Dusseldorf , Germany",False,105,427,0,0
2020-10-06 07:30:45,b'#Freedomofspeech #Censorship is about to GET HUGE! Protect your data and privacy! Please get onto independent platf\\u2026 https://t.co/fZw2KJniRO',Ai,MSMunplugged,,False,2492,2538,0,0
2020-10-06 07:30:09,b'New CGAP research from India &amp; Kenya show that for #digitalfinancialservices providers looking for a competitive ed\\u2026 https://t.co/oaEffJdiNf',CGAP,CGAP,"Washington, DC",True,32004,1917,4,8
2020-10-06 07:28:55,b'Thought I\\u2019d check the privacy policy. One reference to \\u2018usage data\\u2019 under \\u2018non-identifiable data\\u2019 but no explanatio\\u2026 https://t.co/i1B2T6o5CV',Privacy Matters,PrivacyMatters,UK,False,34132,2271,0,1
2020-10-06 07:28:16,"b'\\U0001f91715. Oct 2020, Prof @XenakisChristos from @CUREX_H2020 will explore the #security &amp; #privacy aspects of electronic\\u2026 https://t.co/J7cOJpoAVa'",PRIViLEDGE,PRIViLEDGE_EU,,False,224,215,3,8
2020-10-06 07:27:51,b'I have always felt that these people arguing &amp; screaming over DATA PRIVACY (when govt embarks on new tech or wants\\u2026 https://t.co/9bT02fOMXj',Karuna Gopal,KarunaGopal1,Hyderabad | Delhi | Bangalore,False,39886,872,3,38
2020-10-06 07:25:58,"b""The CJEU has ruled in the Privacy International #dataretention case.\\n\\nWe'll need to see the full judgment for the d\\u2026 https://t.co/GtcgaiCjwf""",Neil Brown,neil_neilzone,England,False,4469,1202,35,40
2020-10-06 07:23:22,b'@ndtv Yes phone is listening. I have analyzed myself many times. \\nAnd data privacy and data theft is something that\\u2026 https://t.co/TfO7gaoRRH',Affaq,OnlyAffaq,"New Delhi, India",False,544,1242,0,0
2020-10-06 07:20:54,"b'Thales Empowers Organisations to Simplify the Discovery, Protection and Control of Sensitive Data\\u2026 https://t.co/Uqb8QqfKmg'",MarTech Series,MarTechSeries,"Hawthorne, CA",False,10478,4248,0,0
2020-10-06 07:20:42,"b'Nobody elected this guy to write laws: \\n\\n""California adopted its current data privacy law, the California Consumer\\u2026 https://t.co/aLiNh0EpSu'",Andrew 7b3ec272-de21-11e7-bd26-e7b414fb0a96 Berger,andrewjbtw,South Bay Area,False,1159,890,0,0
2020-10-06 07:20:02,b'#Cloud Security &amp; Privacy ( #infographic + video ) : https://t.co/nrzEAmbRpO\\n\\n#cloudsecurity #CloudComputing\\u2026 https://t.co/h0BwmyuX9q',Infowebica,infowebica,Europe,False,1341,1562,1,2
2020-10-06 07:16:14,b'Sounds very interesting  - SC Magazine has named Jenny Boneva as one of Europe\\u2019s 50 most influential women in cyber\\u2026 https://t.co/WWxX6oFTWF',Amit Schnitzer,Amit_Schnitzer,"ÜT: 31.242402,34.830573",False,393,518,0,0
2020-10-06 07:13:01,b'#Privacy: The Belgian Data Protection Authority (DPA) will be appearing at the Court of Justice of the European Uni\\u2026 https://t.co/ylplb74DcP',Data Protection World Forum,DataProtectWF,"London, England",False,10265,3332,0,0
2020-10-06 07:13:00,b'#Privacy: The Belgian Data Protection Authority (DPA) will be appearing at the Court of Justice of the European Uni\\u2026 https://t.co/JmS7Mly3hz',PrivSec,PrivSecEvents,Europe,False,5328,1053,0,1
2020-10-06 07:11:00,b'Selling Our Genes: Government inaction allowing private sector to take control of our #DNA\\nhttps://t.co/2j9eayndI4\\u2026 https://t.co/epQ7kKWTjZ',PresidioID,PresidioId,,False,4,4,0,0
2020-10-06 07:10:19,"b""@Hyper_Number @JustinFWolf @ecb There isn't a risk to privacy. There is *no* privacy.\\n\\nDigital assets linked to a d\\u2026 https://t.co/ToWFHn7n68""",The Hegelian,HegelianThe,,False,653,998,0,0
2020-10-06 07:09:56,"b'Your platform data collected and used!\\n\\n\\u201cUnfortunately, even if you do restrict your privacy settings on platforms\\u2026 https://t.co/zlrsdeoG50'",Zac Matthews,ZacMatthz,,False,845,301,0,1
2020-10-06 07:06:57,b'@techstarsrk If you think you privacy in 2020 with cheap data then my friend you stop using phone or use nokia 3310\\u2026 https://t.co/YzQc3wCy51',Ĵ Δ Ŧ Ɨ Ň,jatin_s19,India,False,61,98,0,1
2020-10-06 07:05:37,b'Data Protection Techniques Needed to Guarantee Privacy  null https://t.co/LZPDtQ0bRE #DTHSTR',DTHSTR,CDADeathStar,,False,97,7,0,0
2020-10-06 07:05:00,b'Andrew Yang takes lead in California data privacy measure via /r/privacy https://t.co/5fjIJATGV9',Sebastian petrosi,Sebastianpetr12,Singapore,False,62,287,0,0
2020-10-06 07:04:38,b'New webinar! Join us this Thursday as PRGX\\u2019s #data privacy and security experts outline the importance of #privacy\\u2026 https://t.co/i9kQ3Fzgxh',Heurtevent,cheurtevent,,False,58,509,0,0
2020-10-06 07:04:02,b'The New Role of General Counsel in Today\\u2019s Big Data Privacy Age: ReportComplimentary access to 2020 in-house privac\\u2026 https://t.co/PSuJZQfmVO',Sergiy Gutyuk,gutyuk,New York,False,5081,3951,0,0
2020-10-06 07:02:38,b'New #remotejob | Pear Deck is hiring Contract and Data Privacy Specialist | Apply here \\U0001f449 https://t.co/Rc6sYiH7q8',Remotejob.Page,RemotejobPage,Remote,False,140,33,0,0
2020-10-06 07:00:49,b'Are you looking to protect your data privacy in and out of your organization?\\n\\n\\U0001f4e2 TJC Group provides you a two-way a\\u2026 https://t.co/VTYwdTM55Z',TJC Group,tjcsoftware,Global,False,266,463,1,1
2020-10-06 07:00:25,"b'Thales has developed solutions that protect the integrity and privacy of data, as well as ensuring IoT infrastructu\\u2026 https://t.co/HPoA8z6spM'",Thales Group,thalesgroup,"Paris, France",True,74966,6064,5,9
2020-10-06 07:00:17,b'Which data protection techniques do I need to guarantee privacy? A question we hear quite often! We prepared some e\\u2026 https://t.co/Ehv63zwwsL',Statice,StaticePrivacy,Internet,False,180,171,1,4
2020-10-06 07:00:00,b'@cryptomuser @BronaghByrneQUB @s_mweavingwords @VIEWdigital @kellyandrews149 @ballyaltonboy @j0ekenny @Una_VIEW\\u2026 https://t.co/66OrFfUUbU',Simon Lau,_SimonLau,"San Jose, CA",False,1127,21,0,0
2020-10-06 06:55:34,"b'7. Privacy issues keep growing. \\n\\nAs 3rd party cookies get blocked etc, marketers need to work with their own first\\u2026 https://t.co/N2oSRKp8bE'",Pe:p Laja,peeplaja,"Austin, TX",True,35311,3076,1,3
2020-10-06 06:55:16,b'Tech giants are ignoring questions over the legality of their EU-US data transfers\\n\\nRead more \\U0001f449\\u2026 https://t.co/j6FkigtQSH',DataProtection.blog,DataProBlog,Europe,False,3242,2535,1,1
2020-10-06 06:49:07,b'#offshore #outsourcing #ElectronicHealthRecords  transcribing raises #privacy/#CyberSecurity issues @SenRickScott\\u2026 https://t.co/pYV7gWOmp3',White-Collar Workers of America,WCWOA,United States Of America,False,1133,126,7,7
2020-10-06 06:48:29,"b'@Daijooboobz Due to confidentiality of SSS record and Data Privacy Act, verification of SSS number shall be done in\\u2026 https://t.co/R49L4wHUwP'",Social Security System,PHLSSS,"Quezon City, Philippines",False,27478,81,0,1
2020-10-06 06:46:29,b'The Court of Justice of the EU will today rule on whether UK meets necessary privacy standards to be allowed access\\u2026 https://t.co/037S3nwMLc',Sue Wilson #FBPE,Suewilson91,Spain,False,19222,4474,9,9
2020-10-06 06:39:01,b'The #PRISM program troubles anyone concerned about their privacy. Taking care of your #digitalprivacy by using a VP\\u2026 https://t.co/mEwe7v9EoF',DataProtection.blog,DataProBlog,Europe,False,3242,2535,2,2
2020-10-06 06:38:59,b'IndiaToday speaks about Data Privacy in Aadhar but puts a billion trackers from unreputed operators on their websit\\u2026 https://t.co/FOlUAVNlZI',Param Dāne,DaneParam,"Jammu, India",False,656,345,1,21
2020-10-06 06:35:00,"b'Dataguise has helped global brands in #financial services, #healthcare, #retail &amp; #government ensure the #security\\u2026 https://t.co/dVAvyajahq'",Dataguise,Dataguise,"Fremont, California USA ",False,820,256,0,0
2020-10-06 06:33:55,"b'As China\\u2019s first blockchain-powered hospital is set to launch next year, few government officials have raised their\\u2026 https://t.co/L7FcEWvVWq'",Blockchain Council,ChainCouncil,"California, USA",False,1385,697,0,0
2020-10-06 06:31:57,"b'@Ging772 As checked, there is no PR5654 flight on Oct 16. May we have the booking reference and the registered emai\\u2026 https://t.co/KTl5T9euQG'",Philippine Airlines,flyPAL,,True,3030224,1,0,0
2020-10-06 06:28:27,b'Prediction and Explanation of Privacy Risk on Mobility Data with Neural Networks https://t.co/3BlvRIdfe7',SoBigData,SoBigData,"31 Partners, 15 Countries",False,1401,192,0,0
2020-10-06 06:24:51,b'@Seelanatwork @MechatronixNews This is amazing &amp; incredible way to solve the #privacy issues which are on a continu\\u2026 https://t.co/bKXeMsctH7',PiChainLabs,labs_pi,"Bangalore, India",False,165,63,0,1
2020-10-06 06:23:03,"b'H&amp;M fined \\u20ac35m by German DPA for seriously violating employee privacy. \\n\\nThis #databreach , caused by a configurati\\u2026 https://t.co/Bsd1cdyMn2'",Noora Hammar,H4mNo,"Helsinki, Finland",False,384,123,3,6
2020-10-06 06:19:49,b'The EU court ruling that could end EU-UK data flows\\xa0\\n\\nUK privacy standards need EU signoff for data to keep flowing\\u2026 https://t.co/BwNVlJMdQB',Random Bits #FBPE #Rejoin 3.5%,Rand0mB1tsUK,UK,False,4863,4611,4,2
2020-10-06 06:18:10,"b'Glad you liked the video! My goal was to shed light on the issue of data privacy, especially regarding productivity\\u2026 https://t.co/aKrHjj8xoA'",harshibar,harshibar,the internet,False,370,50,0,7
2020-10-06 06:17:50,b'#Wikipedia Releases #Search #Data To Public But Pulls It After Privacy Concerns\\nhttps://t.co/7ieZOR2xGg https://t.co/JpjxAHjLM8',Caresort Solutions,Caresortweb,"Mohali, India",False,330,1056,0,0
2020-10-06 06:12:11,b'We have a chance to raise questions to European Data Protection Supervisor in the budgetary control procedure of\\u2026 https://t.co/6gNE3cjOMf',Mikuláš Peksa,vonpecka,,True,4211,1832,12,15
2020-10-06 06:10:52,b'Versions of the Indian Privacy Code linked above have been filed over time by Dr. @WriterRavikumar and Dr.\\u2026 https://t.co/Pv41MNHavw',Apar,apar1984,,False,23635,1,5,11
2020-10-06 06:05:32,b'@ndtv Your show on data privacy was good. But it was  like promotion for apple ios14. There have been very frequent\\u2026 https://t.co/moebfCuKKh',Amar Akbar Antony,am_ak_an,,False,5,11,0,0
2020-10-06 06:01:53,"b'@RBI data must be explicitly, legally collected and law should provide provisions for that. It should be sanitized\\u2026 https://t.co/8YrWs0TRRX'",CDFI,IndiaCDFI,"New Delhi, Delhi",False,1449,523,0,2
2020-10-06 06:00:02,b'Digital facial recognition. COVID-tracing apps. Innovations that make trips safer during a pandemic might expose yo\\u2026 https://t.co/wV50INICNU',Omur Oztas,Oztaso,Izmir,False,237,141,0,0
2020-10-06 06:00:00,b'Pooling data rights to negotiate better with platform companies can help rebalance power in the data economy and ad\\u2026 https://t.co/BumFyOhA1K',ORF,orfonline,India,True,79080,142,1,4
2020-10-06 05:56:06,b'@airtelindia which kind of customer data security &amp; privacy r u using. I complain on 4th Oct in 121 that my amount\\u2026 https://t.co/gDRwJvXr14',Bhikhari yadav,bhi_yadav,"New Delhi, India",False,1,35,0,0
2020-10-06 05:54:52,b'@henry_young Hi @henry_young! Thank you for reaching out to Converge Social Media. Allow us to assist you according\\u2026 https://t.co/3CseNWgB0Q',Converge ICT,Converge_CSU,Pasig City,False,31247,100,0,0
2020-10-06 05:52:55,"b""#China's #tech giants face \\u2018new business realities\\u2019 across the world:\\n\\nThe tough political environment between Chin\\u2026 https://t.co/tRa2TmNO0i""",Urs Bolt | ti&m 🇨🇭,UrsBolt,"Zürich, Schweiz 🇨🇭",False,13030,3986,8,8
2020-10-06 05:52:51,b'@aicowei Hi @aicowei! Thank you for reaching out to Converge Social Media. Allow us to assist you accordingly by se\\u2026 https://t.co/g51hpY61mC',Converge ICT,Converge_CSU,Pasig City,False,31247,100,0,0
2020-10-06 05:49:50,"b'""Due to the flexibility and customization of Archer, we captured critical and key statistics. Now we have nearly 8\\u2026 https://t.co/MqIfvdYihY'",RSA,RSAsecurity,Global,True,118206,3061,0,1
2020-10-06 05:49:17,"b'@CryptoNationIN @ReefDeFi Now have many super hackers so security, scalability, and data privacy are three aspects\\u2026 https://t.co/aOWIunYI3H'",Elvie D'Amore,AmoreElvie,,False,31,68,0,0
2020-10-06 05:46:47,b'Just earned the California Consumer Privacy Act Basics badge on @Trailhead and you should too! https://t.co/Pckl71isjZ',kira,syaaakira1,,False,222,145,0,1
2020-10-06 05:43:24,b'#HEGovernors last chance to register for the @PwC_UK webinar this Wednesday at 5pm on #data privacy in\\u2026 https://t.co/x1Cnllgeyf',Karen Finlayson,KarenMFinlayson,"Doncaster, England",False,1110,534,0,1
2020-10-06 05:41:15,b'Just earned the US Privacy Law Basics badge on @Trailhead and you should too! https://t.co/Q5KneEr1R7',kira,syaaakira1,,False,222,145,0,0
2020-10-06 05:37:33,b'NIST crowdsourcing challenge aims to de-identify public data sets to protect individual privacy\\u2026 https://t.co/QRjsHxDaNT',CrowdHydrant,CrowdHydrant,"Cincinnati, OH USA",False,1024,851,0,0
2020-10-06 05:26:06,"b""@ngmarco Maybe she's data privacy mama trying to protect your image!!""",Anna Burek,aeburek,"Seattle, WA",False,203,375,0,0
2020-10-06 05:24:20,b'Just earned the European Union Privacy Law Basics badge on @Trailhead and you should too! https://t.co/KGXMCmz5oX',kira,syaaakira1,,False,222,145,0,0
2020-10-06 05:21:54,b'\\U0001f6a8ATTENTION\\U0001f6a8\\nPlease report and block https://t.co/G3uqGHscYk . That acc has been tweeting terribly violent staffs.\\u2026 https://t.co/oz56vKudHU',Heeseung Japan Fanbase,Heeseung_JPFB,,False,1560,48,9,16
2020-10-06 05:14:38,"b""Turns out the people who said Alexa was always listening weren't crazy after all. That data is now being collected\\u2026 https://t.co/q9Ydw4OC9c""",American Eagle,trump_trainchoo,Main Street verses Wall Street,False,4715,4704,0,0
2020-10-06 05:11:01,"b'Keep your data privacy intact, use  https://t.co/BBqTAA7SSc #legaltech #netsec #security #techlife #technologynews\\u2026 https://t.co/BNRGMK9WtS'",MIssionImproxyble,MImproxyble,,False,3002,2951,0,0
2020-10-06 05:08:25,b'@SekaiFarai True - but you gotta wonder if the challenges that result from new innovations were bound to arise rega\\u2026 https://t.co/o9mcSZWpJS',Ian Ko,IanKo8,"Toronto, Ontario",False,274,629,0,0
2020-10-06 05:04:27,b'Taiwan\\u2019s two largest job posting sites hacked and data of half of workforce sold for a fraction of the price. This\\u2026 https://t.co/sY3jgSRVMc',T.H. Schee,scheeinfo,Taiwan,False,3113,355,4,6
2020-10-06 05:03:09,b'@ZarMarquez @NoOn24CA @Praxis_Project Simple. #Prop24 weakens your privacy protections under California law and mak\\u2026 https://t.co/XGdVw2a7fk',Media Alliance,twrling,"San Francisco, CA",False,2928,1411,2,3
2020-10-06 05:03:00,b'How concerned should policymakers be about the potential for data privacy &amp; security breaches on TikTok?\\n\\nOn this\\u2026 https://t.co/fib07noYjg',ANU Crawford School,ANUCrawford,Canberra,True,9459,847,1,3
2020-10-06 05:01:13,b'Adaptation to the GDPR (General Data Protection Regulations) \\n#dataprotection #privacy #policy #freelancers #Spain\\u2026 https://t.co/3IVeXk3rl3',Selfemployed Spain,SelfemployedS,Spain,False,76,51,0,0
2020-10-06 05:00:12,"b""IoTeX's Ucam camera fully secured on blockchain #iotex #bitcoin #ownyourprivacy #data #Security #ownyourdata\\u2026 https://t.co/iiuG3M9KFT""",Adejumo Adekunle,tadex01,Osogbo,False,214,1461,0,2
2020-10-06 04:59:52,"b'@SanjayDhotreMP @RaiseAISummit @_DigitalIndia Great sir, but We should have a law , a very stringent law to be deve\\u2026 https://t.co/6z1wQDHZAD'",EnolaHolmes👩‍💻,enolaholmes007,Magicland,False,82,99,0,0
2020-10-06 04:58:29,"b'@rsprasad @htTweets We should have a law , a very stringent law to be developed ASAP on AI before projects get roll\\u2026 https://t.co/DIeEaeObaG'",EnolaHolmes👩‍💻,enolaholmes007,Magicland,False,82,99,0,0
2020-10-06 04:58:00,b'The online version of my @marieclaire Security &amp; Privacy Quiz shows how folks have answered questions. So far a sta\\u2026 https://t.co/SffYg5WoSC',Rachel Tobac,RachelTobac,San Francisco,False,49220,6618,13,76
2020-10-06 04:55:49,"b'In this course, you will learn how to identify and meet data requirements while designing and implementing the mana\\u2026 https://t.co/oRL9kbzQnn'",Synergetics Learning & Cloud Consulting,synergetics1,Mumbai,False,244,269,0,1
2020-10-06 04:52:20,b'Visit Amazon to get your Ucam security camera today #iotex #bitcoin #ownyourprivacy #data #Security #ownyourdata\\u2026 https://t.co/ZRzjlxfH15',Adejumo Adekunle,tadex01,Osogbo,False,214,1461,0,1
2020-10-06 04:49:57,"b'Ucam, the absolute packaged privacy home camera designed for you #iotex #bitcoin #ownyourprivacy #data #Security\\u2026 https://t.co/xg1ES64yGQ'",Adejumo Adekunle,tadex01,Osogbo,False,214,1461,0,2
2020-10-06 04:49:25,"b'""Employee data is a totally new domain,\\u201d says @jmichel_franco, @Talend\\u2019s Senior Dir. of Product Marketing, \\u201cwith sp\\u2026 https://t.co/pjlJb5clpn'",しんすけ,shinshin_s,,False,10,11,0,0
2020-10-06 04:47:10,"b'IoTeX Project updates for August-September, 2020 #iotex #bitcoin #ownyourprivacy #data #Security #ownyourdata\\u2026 https://t.co/ud9u9uo9xL'",Adejumo Adekunle,tadex01,Osogbo,False,214,1461,0,2
2020-10-06 04:46:43,b'But when the personal data privacy concerns while raising new challenge that would pass the reach of hybrid\\u2014is a bogus address).',Fun with Bots,KarenzBotz,,False,16,10,0,0
2020-10-06 04:46:43,"b'Officially have an online version of this Security and Privacy quiz I created for @marieclaire, feel free to send t\\u2026 https://t.co/rlqbiuM7hi'",Rachel Tobac,RachelTobac,San Francisco,False,49220,6618,18,34
2020-10-06 04:45:08,"b'Ucam, an indoor security camera powered on IoTeX Blockchain #iotex #bitcoin #ownyourprivacy #data #Security\\u2026 https://t.co/AMmF1bkDSC'",Adejumo Adekunle,tadex01,Osogbo,False,214,1461,0,2
2020-10-06 04:42:42,b'Weekly News of IoTeX #iotex #bitcoin #ownyourprivacy #data #Security #ownyourdata #ethereum #Top25 #IoT #blockchain\\u2026 https://t.co/IGGmJWGQ0N',Adejumo Adekunle,tadex01,Osogbo,False,214,1461,0,2
2020-10-06 04:39:39,b'IoTeX 6-Month social activities #iotex #bitcoin #ownyourprivacy #data #Security #ownyourdata #ethereum #Top25 #IoT\\u2026 https://t.co/DR0oAFrkqb',Adejumo Adekunle,tadex01,Osogbo,False,214,1461,1,3
2020-10-06 04:39:05,b'@JEChalmers @LathamNorm @AustralianLabor has been talking up an AI Centre for its data breach privacy rort yrs. Thi\\u2026 https://t.co/dxMZl8rbT0',Tracey Hoolachan,democracydemon1,Australia,False,847,1078,2,1
2020-10-06 04:37:06,"b'Ucam, privacy and security camera worth possession #iotex #bitcoin #ownyourprivacy #data #Security #ownyourdata\\u2026 https://t.co/3wMOK1MI43'",Adejumo Adekunle,tadex01,Osogbo,False,214,1461,0,2
2020-10-06 04:22:23,"b'Register for Tech Tuesdays Webinar - Intelligent Data Privacy and Governance on Tuesday, Oct 20, 2020 at 8:00 AM PT\\u2026 https://t.co/ZKNeHUH5hA'",Informatica Support,INFAsupport,"Redwood City, CA",False,2116,142,0,0
2020-10-06 04:21:10,"b""What are #you do #reading this #tweet and you aren't #watching #TheSocialDilemma?\\n#socialdilemma #data #privacy\\u2026 https://t.co/xqMfFWwjH1""",Alain Sánchez,mr_brazzi,"La Habana, Cuba",False,178,414,0,0
2020-10-06 04:20:00,"b'Reliance Industries chairman Mukesh Ambani said countries in the future would compete over data capital, and underl\\u2026 https://t.co/VmVNNvKv1Y'",ETtech,ETtech,India,True,15067,428,2,2
2020-10-06 04:17:29,"b""@twrling @NoOn24CA @Praxis_Project Whats the reasoning behind no on Prop24?\\n\\nData Privacy Rights for Californian's\\u2026 https://t.co/BI9TxwBsOd""",Cesar Ⓜ️arquez 🧢📲,ZarMarquez,"Reno, NV",False,5654,6187,0,0
2020-10-06 04:16:09,b'@Praxis_Project Whats the reasoning behind No on Prop24?\\n\\nPrivacy Data Rights are super important and we should be voting @YesOn24.',Cesar Ⓜ️arquez 🧢📲,ZarMarquez,"Reno, NV",False,5654,6187,0,0
2020-10-06 04:15:01,"b""@HoffmanMichaelA Don't forget also Americans want their data collected on every transition and don't care about privacy""",Ian,pois0nxxl,,False,7,30,0,6
2020-10-06 04:11:02,b'Keep your personal data intact :  https://t.co/BBqTAA7SSc #advertising #howto #infosec #online #privacy #techtips\\u2026 https://t.co/RiAjN8ZwmT',MIssionImproxyble,MImproxyble,,False,3002,2951,0,0
2020-10-06 04:09:58,"b""@niteshsaxena15 We understand your concern. Please know, our user's data security is of utmost importance to us &amp; y\\u2026 https://t.co/zF5mnlJTnf""",@PhonePeSupport,PhonePeSupport,India,True,41421,4,0,0
2020-10-06 04:09:28,b'@WhatsApp hey whatsapp @sardesairajdeep a journalist from india questions ur data privacy policy.Can u educate him\\u2026 https://t.co/k7Jm9GANjA',ks,saurabhkanth786,भारत,False,49,191,0,0
2020-10-06 04:05:54,b'@alvin_cabela Hi @alvin_cabela! Thank you for reaching out to Converge Social Media. Allow us to assist you accordi\\u2026 https://t.co/RlaOh7ikay',Converge ICT,Converge_CSU,Pasig City,False,31247,100,0,0
2020-10-06 04:04:08,b'Have you signed up for the Masterclass 2020 yet?\\n\\nLast few seats and special offers!\\n\\nCOMPLIANCE 10/10: Masterclass\\u2026 https://t.co/SCQCXwA0Fn',Legasis,LEGASIS,,False,68,69,0,0
2020-10-06 04:03:34,b'Accessing Data Privacy Risks and knowing whether an organization is compliant with certain legal parameters are two\\u2026 https://t.co/7ssQhuUEQd',Data Governance Framework,gdprAI,"England, United Kingdom",False,2883,1,1,0
2020-10-06 04:00:01,"b'Data Protection During and After the Pandemic: Consolidate, Update and Innovate\\nhttps://t.co/FJ3zk4n7vO\\u2026 https://t.co/CoZomzRS5f'",Start with Identity,startidentity,San Fancisco,False,359,233,5,5
2020-10-06 04:00:00,"b'Tomorrow, @ukutaht in conversation with Mahima Sood and Naresh Bharadwaj on how https://t.co/2I9jUEgLQR address\\u2026 https://t.co/ertaWKJWmv'",The Fifth Elephant,fifthel,"Bangalore, India",False,2423,54,3,2
2020-10-06 03:59:20,b'Have you signed up for the Masterclass 2020 yet?\\n\\nLast few seats and special offers!\\n\\nCOMPLIANCE 10/10: Masterclass\\u2026 https://t.co/3iRu65JeYg',Legasis,LEGASIS,,False,68,69,1,2
2020-10-06 03:57:58,"b'Today\\u2019s blog post reflects on #NetThing 2020, held on October 1&amp;2. We explore ideas discussed including data privac\\u2026 https://t.co/OWZkJpO1L2'",Afilias dotAU,AUdomain,"Melbourne, Victoria",False,212,213,2,1
2020-10-06 03:56:19,b'@chrisquinal Please note that providing these information means that you have read and agree to the PLDT Enterprise\\u2026 https://t.co/KgJMGkjeNS',PLDT Enterprise,PLDTEnterprise,,True,7978,189,0,0
2020-10-06 03:56:01,b'@teamjob3rt Hi @teamjob3rt! Thank you for reaching out to Converge Social Media. Allow us to assist you accordingly\\u2026 https://t.co/16dtD87Bl9',Converge ICT,Converge_CSU,Pasig City,False,31247,100,0,0
2020-10-06 03:56:01,b'@bertiecharlton This looks awesome Andrew!\\n\\nQuestion: how is data stored / managed with the reforecasting models? H\\u2026 https://t.co/ps385RXLIa',Kyle Faber,regal_kyle,"Milwaukee, WI",False,1067,847,0,1
2020-10-06 03:55:30,b'@dalejacinto Hi @dalejacinto! Thank you for reaching out to Converge Social Media. Allow us to assist you according\\u2026 https://t.co/Ejmgb3MCL8',Converge ICT,Converge_CSU,Pasig City,False,31247,100,0,0
2020-10-06 03:54:53,b'@henry_young Hi @henry_young! Thank you for reaching out to Converge Social Media. Allow us to assist you according\\u2026 https://t.co/S72RmzTgZN',Converge ICT,Converge_CSU,Pasig City,False,31247,100,0,0
2020-10-06 03:53:38,"b'16/ #Prop24 effectively preserves the CA Consumer Privacy Act, which gives us protections similar to Europe\\u2019s. Give\\u2026 https://t.co/guktVwoKsz'",Patrick Siegman,PatrickSiegman,,False,882,10,1,2
2020-10-06 03:53:09,"b'#RelianceIndustries (RIL) chairman #MukeshAmbani said countries in the future would compete over data capital, and\\u2026 https://t.co/e9pEjIF6Hg'",Inc42,Inc42,"Delhi, India",False,25562,240,0,1
2020-10-06 03:50:41,"b'Mass remote work has created many challenges for cybersecurity, but while there is a lot of chatter about the rise\\u2026 https://t.co/6pGpbXUJ7H'",Global Fraud Chat,globalfraudchat,Vancouver BC ,False,310,1917,0,1
2020-10-06 03:46:43,b'My music at the \\u201cfundamentally person-centered\\u201d data privacy .',Fun with Bots,KarenzBotz,,False,16,10,0,0
2020-10-06 03:46:41,"b'Quest for long healthy life is what differentiates living beings from the dead. Yet, healthcare has not benefited f\\u2026 https://t.co/TxeXyhEIv2'",Ambuj Kumar,ambuj0,"California, USA",False,233,71,0,3
2020-10-06 03:46:16,b'@vernalkick My last resort is to grab the unsymbolicated crash log from the device itself from Settings\\xa0&gt; Privacy &gt;\\u2026 https://t.co/az4KoWq0nD',Felix Lapalme,lap_felix,"Montreal, Canada",False,833,317,0,0
