created at,text,name,screen name,location,verified,followers count,friends count,retweet count,favorite count
2020-10-08 23:59:08,"b'Privacy settings for the whole internet?\\n\\n\\u201cThe new standard, called Global Privacy Control, will let you activate a\\u2026 https://t.co/lszTc5JszM'","April C. Wright, ""in these uncertain times""",aprilwright,"Boston, MA",False,16865,3649,2,8
2020-10-08 23:57:45,"b'Cybersecurity has always been seen as an equation between risk tolerance, compliance and cost. The \\u201cWhen-Not-If\\u201d pa\\u2026 https://t.co/BIDbvIJ2oR'",IoT For All,iotforall,United States,False,10150,3650,8,6
2020-10-08 23:52:27,b'@jpostman You know those notices are required because in Europe they take personal data privacy more seriously than our government does?',Steve Lubetkin,podcaststeve,"Cherry Hill, NJ",False,3834,2207,0,2
2020-10-08 23:48:50,b'@BozKuhi @AlecStapp @scottlincicome The argument you seem to be making is that using a data append is a violation o\\u2026 https://t.co/jFutPblD78',Chris M,chrismckoy,,False,295,1327,0,0
2020-10-08 23:45:59,"b""How do I know they're okay with this?\\n\\nIn the \\u2018Draft National Policy on E-Commerce and Digitization for The Commonw\\u2026 https://t.co/56t6Y0Nk0i""",Brent Burrows II,BBurrowsII,Bahamas,False,35,122,0,0
2020-10-08 23:39:23,"b'@tweetgravity @AITA_reddit It may not necessarily be live, I may have misremembered, but they listen to a *lot* for\\u2026 https://t.co/BdPR8hNots'",Spooky Ghost Rat,MorsRattus,"Connecticut, USA",False,306,367,0,3
2020-10-08 23:30:42,b'@LostinAllure weaknesses and find the best ways to attack them...\\n\\nHe loved this modern technology.\\nEverything was\\u2026 https://t.co/eBjwXg02Gz',𝕮𝖆𝖎𝖓,Cain_Azazel,FaceClaim - Toni Mahfud,False,124,134,0,1
2020-10-08 23:25:13,"b'When discussing the commodification of social data, Fuchs did a really great, yet scary, job of discussing the nega\\u2026 https://t.co/eaMHE2q4T0'",sydney elliott,SydneyE_SM,,False,13,13,1,1
2020-10-08 23:21:45,b'From the Ashes of Do Not Track Rises a New Global #Privacy Control https://t.co/L5ggj9XuS3',Angsuman Chakraborty,angsuman,India,False,7748,5248,0,0
2020-10-08 23:15:03,b'Two rogue members of the @Shopify support team were engaged in a scheme to obtain customer transactional records of\\u2026 https://t.co/dpZG2zpb6w',State Creative,StateCreative74,"Oakland, CA",False,324,314,0,0
2020-10-08 23:15:00,b'Learn out. Germany revisits influential internet law as amendment raises privacy implications\\u2026 https://t.co/w6W134wLj3',Kohei Kurihara -DataPrivacy for Fighting Covid-19-,kuriharan,"Tokyo-to, Japan",False,51431,39968,2,0
2020-10-08 23:13:29,b'Indonesia Soon to Become the Fifth ASEAN Country to Adapt Data Privacy Laws:\\n\\nhttps://t.co/wQ2FGLtgTp',Ravindra Das,cadmiumadvtech,Offices in Chicago & Austin,False,165,48,0,0
2020-10-08 23:11:36,"b'@Jamie_Freed ""I\'ve been saying our data is very valuable.\\u201d So now we know Tony takes the Google approach, and not t\\u2026 https://t.co/4J8Ipvram2'",asharom,asharom,Malaysia,False,188,857,0,0
2020-10-08 23:10:34,"b'""This \'keyword warrant\' evades the Fourth Amendment checks on police surveillance. When a court authorizes a data d\\u2026 https://t.co/eeeNp5zVie'",Heather Federman,FedaHeda,"New York, NY",False,395,324,0,1
2020-10-08 23:09:31,b'@sarbjeetjohal @briansolis @BillMew @alanlepo @furrier @dvellante @karaswisher @profgalloway @dhinchcliffe @rwang0\\u2026 https://t.co/6xqprhWOJP',Bob Morris,digitalquotient,"Atlanta, GA",False,1855,1586,3,5
2020-10-08 23:08:23,b'The recent HealthEngine decision serves as a timely reminder to businesses that breaches of privacy may lead to the\\u2026 https://t.co/DAbSLr61Sw',Thomson Geer,ThomsonGeer,Australia,False,262,298,3,0
2020-10-08 23:04:44,b'Malicious NPM packages broadcast sensitive user data online\\n\\n#infosec #privacy #cybersecurity #encryption #hacking\\u2026 https://t.co/Y98NDGy93I',〰 Ꮹ 천사 〰,UnequalG,,False,150,133,2,0
2020-10-08 23:04:02,"b'@SES_rationale @abcnews Good point, is a data breach a more serious charge? In saying that I see it as a invasion o\\u2026 https://t.co/CnHYvnPzz7'",Arkin,ArkinBarkin,Australia,False,14,27,0,1
2020-10-08 23:02:56,"b'Facing a shifting tech &amp; privacy landscape, the \\n@GoogleNewsInit APAC Data Lab Playbook was created in partnership\\u2026 https://t.co/9UNzXLDxmD'",MightyHive,mightyhive,"San Francisco, CA",False,1193,234,2,5
2020-10-08 23:00:00,b'The pandemic is an opportunity to re-examine and reorder systems and create new ones that better reflect the person\\u2026 https://t.co/VtwPmMmEeY',ORF,orfonline,India,True,79079,142,1,5
2020-10-08 22:58:53,b'Brave Browser Leads New Global Privacy Standard - https://t.co/5XqjQWHmx9',Plato Data Intelligence,plato_data,New York City,False,27,63,0,0
2020-10-08 22:56:41,"b""did anyone else loose their 'liked video' playlist privileges on yt? They must be smack bang in the middle of the c\\u2026 https://t.co/Y3ydGqg4OT""",Aʅιƈҽ Uɳԃҽɾɠɾσυɳԃ,cmf_news,Earth,False,5,322,0,0
2020-10-08 22:56:34,b'The biggest advantage EXTONS has to offer is our high level of privacy for all transactions. Your data will be full\\u2026 https://t.co/ahNhyF0MQ7',Edmund Ben,KryptoIcing,,False,2376,3332,0,0
2020-10-08 22:55:13,b'@CryptoFun_ID @financedotvote Protecting users/member data and privacy has become a problem that many companies/pro\\u2026 https://t.co/rrEm6lNYPL',Mid Or Feed,ranfille,,False,58,117,0,0
2020-10-08 22:52:40,"b'i think its important to discuss issues not shut everyone out cuz not like u. not force loss of privacy, data, tryi\\u2026 https://t.co/d5QizzXqnt'",Headless Eyes Some losers using my name,Leos_Universe,"Los Angeles, CA",False,45,4,0,0
2020-10-08 22:48:59,"b""One of the most popular cases of censorship was in India when TikTok was banned as it does not align with India's p\\u2026 https://t.co/SwtkW9FSUP""",Abidemi Olokun,AbidemiOlokun,,False,22,21,0,0
2020-10-08 22:47:59,b'2018: Google announced that it exposed the private info of hundreds of thousands of Google+ users between 2015 and\\u2026 https://t.co/BEHipeDQwp',Today In Infosec,todayininfosec,,False,35971,1,4,6
2020-10-08 22:47:58,b'@csdoctorsister That is the bane of my existence. We need a comprehensive federal privacy law that is similar to CC\\u2026 https://t.co/e9F18oc0jj',Bärí A. Williams,BariAWilliams,"Oakland, CA",True,31700,6079,0,3
2020-10-08 22:44:33,b'The Global Privacy Control alliance has developed tech to stop sites from selling or sharing the data they gather a\\u2026 https://t.co/P2O8pyrTmG',Norton,Norton,,True,147746,22171,4,4
2020-10-08 22:43:52,"b""@jowouters @CoronalertBe That's the goal, yes. But this is personal data for sure. \\nThere are definitely actors in\\u2026 https://t.co/vCdh6FjsGZ""",Paul-Olivier Dehaye,podehaye,Www.PersonalData.IO,False,20574,1585,0,2
2020-10-08 22:41:00,b'Here are 3 fundamental tips to get started with a #datagovernance program and support your #digitaltransformation g\\u2026 https://t.co/xuIHWakHJ9',Informatica,Informatica,"Redwood City, CA",True,110414,973,1,1
2020-10-08 22:38:20,"b'Earlier this year, the California Consumer Privacy Act was implemented. Get answers to your questions about this ne\\u2026 https://t.co/8WeTndVD5a'",Shred-it,Shredit,,True,4560,918,0,0
2020-10-08 22:35:08,b'Do Telehealth apps put the security and privacy of medical data at risk? #techblogs #community https://t.co/9xotwdVcz8',ATLANTA TECH BLOGS,ATLTechBlogs,"Atlanta, GA",False,18083,18694,0,0
2020-10-08 22:35:04,b'A government watchdog\\u2019s probe into IRS use of cell phone location data is likely to run into legal uncertainty abou\\u2026 https://t.co/BFSFvPyq0p',Bloomberg Tax,tax,"Arlington, VA",True,16878,644,3,0
2020-10-08 22:30:22,"b""Are data privacy laws like CCPA giving you headaches? Let Clym help! We'll guide you through onboarding to our plat\\u2026 https://t.co/3K5XPNQSNa""",Clym,ClymLtd,United Kingdom,False,88,139,1,0
2020-10-08 22:30:00,b'Check it. Forget Tracking Your Period\\u2014Your Period (App) Is Tracking You https://t.co/klH4cLe18b #tech #digital #data #privacy',Kohei Kurihara -DataPrivacy for Fighting Covid-19-,kuriharan,"Tokyo-to, Japan",False,51431,39968,0,0
2020-10-08 22:29:54,"b'@TSS_Raj Enforce federal anti-trust laws. Also, we need a comprehensive federal privacy law for these data powerhouses.'",Bärí A. Williams,BariAWilliams,"Oakland, CA",True,31700,6079,0,2
2020-10-08 22:29:25,b'@usefathom BTW.. @recap_io\\u2019s new site is plumbed into Fathom. Privacy-focused crypto accounting meets privacy-focus\\u2026 https://t.co/c0nrLlkp5t',Dan Howitt,dan_howitt,United Kingdom,False,64,128,0,2
2020-10-08 22:27:00,"b'Guidelines look like 4-10 months, with option of probation if there is also a condition of home confinement or half\\u2026 https://t.co/pTKb5TUaNs'",Peter Reilly,peterreillycpa,North Oxford Mass,False,6493,6863,0,1
2020-10-08 22:26:14,b'@Ernst_Blofield @bsdlp Prop 24 has LESS protections. Please vote No. I was a coauthor of the CCPA (current law) and\\u2026 https://t.co/8y6316ljKG',Mary Stone Ross,MarySRoss18,,False,525,699,0,0
2020-10-08 22:26:07,b'@Oreocide I mean... we all carry phones that microsoft/google/apple do the same with and then sell our data so I gu\\u2026 https://t.co/aY1b6IpL6A',Oddy the Bard,OddyCreates,"Seattle, WA",False,94,113,0,1
2020-10-08 22:25:25,b'@jnniferma Please vote No. I was a coauthor of the CCPA (current law) and Prop 24 undermines our privacy protection\\u2026 https://t.co/TqqgYfGYmQ',Mary Stone Ross,MarySRoss18,,False,525,699,0,1
2020-10-08 22:24:45,b'@KateKayeReports Any device capturing personal data without explicit consent is surveillance tech. If you asked thi\\u2026 https://t.co/XdkGnLXY1t',Steve Fong,swfong,SF,False,96,371,0,9
2020-10-08 22:19:06,b'OptMeowt allows Web users to make use of their rights to opt out from the sale and sharing of personal data  With t\\u2026 https://t.co/NnVoPo0T1z',⇄ Σ = Mᄃ² ⇆,exksmc,here & mostly over ➡️,False,399,1110,0,0
2020-10-08 22:10:37,"b'@felon_fred @JoeBiden @realDonaldTrump @AndrewYang No.\\n\\nA vote for Trump is a vote for never getting UBI, Democracy\\u2026 https://t.co/ZXDUzOqGcf'",Smitty🧢💡🍎🌄🦄≥,A_Smitty_56,,False,919,2918,0,3
2020-10-08 22:10:04,"b'Germany has fined H&amp;M $145 million for collecting and not protecting the private information on employees, showing\\u2026 https://t.co/GBUTtmlwj9'",tegocyber,tegocyber,"Las Vegas, NV, USA",False,382,9,0,0
2020-10-08 22:06:43,"b'InnerHour, noticeably doesn\\u2019t do\\u2014and what their data privacy discussions.) Figure 4 shows how their downfall, since their'",Fun with Bots,KarenzBotz,,False,16,10,0,0
2020-10-08 22:06:01,b'#BigData and its impact on our #privacy is one of the biggest challenges of the 21st century. https://t.co/jRWoZP9Ay5',Techopedia,techopedia,Worldwide,False,8737,1510,2,0
2020-10-08 22:05:56,b'Apple has baked even more security into iOS 14 and iPadOS 14 for iPhones and iPads to keep you and your data safe.\\u2026 https://t.co/BMY5BD51eH',Dr. Vivian Lyon,vivianlyon,Atlanta Georgia,False,207,741,0,0
2020-10-08 22:05:55,b'Apple has baked even more security into iOS 14 and iPadOS 14 for iPhones and iPads to keep you and your data safe.\\u2026 https://t.co/Hek3LsNh1P',Plaza Dynamics,PlazaDynamics,Atlanta Georgia,False,311,1502,0,0
2020-10-08 22:03:39,b'Accessing Data Privacy Risks and knowing whether an organization is compliant with certain legal parameters are two\\u2026 https://t.co/vFQGC241I7',Data Governance Framework,gdprAI,"England, United Kingdom",False,2883,1,1,0
2020-10-08 22:02:06,"b""Privacy regulations aren't going away - it's time to adopt technology that makes a meaningful impact on data\\u2026 https://t.co/sc2dIOhw4F""",Rpcaccounting,rpcaccounting,"Ottawa, Ontario",False,36,357,0,0
2020-10-08 22:01:57,"b'A virtual private network (VPN) acts as an added security &amp; privacy intermediary, whereas normally your device tran\\u2026 https://t.co/VDwk5fNuEW'",Gadget Genie,gadgetgeniecom,"Federal Way, WA",False,101,114,0,0
2020-10-08 22:00:47,b'@acryptoverse @wootraderS Protecting users/member data and privacy has become a problem that many companies/project\\u2026 https://t.co/YthACMfIRn',Mary,Mary47229678,"Bangladsh,Dhaka,Jamalpur ",False,124,409,0,0
2020-10-08 22:00:40,"b""For everyone who just learned how the internet makes money from watching the Social Dilemma, here's an exciting pro\\u2026 https://t.co/XmXUjFg5sn""",Ari Levine,arilevine,BKNY,False,2981,3035,0,0
2020-10-08 22:00:29,b'You may be revealing more than you think. Check your #privacy and #security settings to limit how much data you giv\\u2026 https://t.co/YztzJKJrQr',OmniTechPro,omnitechpro,"Salisbury, MD",False,88,89,0,0
2020-10-08 22:00:14,b'\\u2696\\ufe0f Wow read because of news cycle flew under rader. What Europe did on privacy rights could cut billions of market\\u2026 https://t.co/5tmCUpnnGC',Dustin Haviv,DustyFish770,"Mastic, NY",False,427,2184,1,1
2020-10-08 22:00:11,b'Privacy News: From the Ashes of Do Not Track Rises a New Global Privacy Control https://t.co/APrRGdUUTy #readdestroy #privacy',read-destroy,DestroyRead,,False,24,392,0,0
2020-10-08 22:00:06,b'The U.S. wants smartphone location data. https://t.co/nIMbGwMrPE',Wilfrid Blanc,WilfridBlanc,Lyon - France,False,247,311,0,0
2020-10-08 22:00:01,"b""Don't miss our first Pivot by Zone Learning event! We'll be exploring the ethics and attitudes around data and priv\\u2026 https://t.co/dMhULohy7a""",RU Zone Learning,RUZoneLearning,"Toronto, ON",False,2174,761,2,0
2020-10-08 21:59:02,"b'Is Your Favorite Podcast Tracking You? \\u2014 Podcast listening is hard to track, but that doesn\\u2019t mean advertisers aren\\u2026 https://t.co/CigrL33LnI'",Peter Murray,DataG,"Columbus, OH",False,1265,614,0,0
2020-10-08 21:58:23,b'@cartomey @byKateSmith I think this is an accurate representation of the incomplete data they collected. But in my\\u2026 https://t.co/wa3ugn4vkn',this timeline is trash,razorconfetti,,False,4,144,0,0
2020-10-08 21:57:25,b'Privacy-centric crypto project @monero was one of the few cryptocurrencies that have been able to shrug off last mo\\u2026 https://t.co/ZrSNUd63IQ',Crypto Briefing,Crypto_Briefing,🌐,False,11371,369,1,2
2020-10-08 21:46:33,b'@CryptoFun_ID @financedotvote Protecting users/member data and privacy has become a problem that many companies/pro\\u2026 https://t.co/DaJveSCw6k',MD.RAJU AHMED,Raju42000,,False,47,305,0,0
2020-10-08 21:45:57,"b'As the world becomes more digitally connected and as technology advances, gathering, using, and storing biometric d\\u2026 https://t.co/I2XDOYZOt2'",Lockton Denver,LocktonDenver,"Denver, CO",False,346,440,0,1
2020-10-08 21:45:00,"b'Check it. The Inside Story of MacKenzie Scott, the Mysterious 60-Billion-Dollar Woman by Stephanie Clifford in\\u2026 https://t.co/L8co5K9Cib'",Kohei Kurihara -DataPrivacy for Fighting Covid-19-,kuriharan,"Tokyo-to, Japan",False,51431,39968,0,0
2020-10-08 21:41:02,b'Protect your personal data with  https://t.co/BBqTAA7SSc #assange #howto #infosec #online #privacy #stopcensorship\\u2026 https://t.co/Jw0kKPQk2I',MIssionImproxyble,MImproxyble,,False,3002,2951,1,1
2020-10-08 21:40:13,"b'Nobody likes a pop-up notification, but when they contain information about data privacy they\\u2019re worth paying atten\\u2026 https://t.co/uMpNnWRxZg'",AIGA Eye on Design,AIGAeyeondesign,,False,24548,491,2,23
2020-10-08 21:34:07,b'Evolution\\nEvolutionary psychology\\nExistentialism\\nExperiment\\nFacebook\\nMessage\\nFantasy\\nFiction\\nBooks\\nPrivacy\\nPersonal\\u2026 https://t.co/TYmGMyqgpg',Michael Jelly,michaeljelly,London,False,228,438,0,0
2020-10-08 21:33:02,"b""It's OK, you don't have to whisper. Google Assistant's new Guest Mode doesn't record or save requests, but also doe\\u2026 https://t.co/mQuf0CCoNt""",Martin Waxman,martinwaxman,"Toronto, ON",True,13496,7783,0,0
2020-10-08 21:30:06,b'Feeling a little nervous about technology\\u2019s intrusion into the public health space and privacy? It\\u2019s understandable\\u2026 https://t.co/bnN5VmWFxL',FOW Media,fow_media,Global ,False,1841,4819,0,0
2020-10-08 21:30:06,"b""@CryptoBac I'd say $SYLO coz it is a breath of fresh air in a trustless world of data gathering and privacy mis-man\\u2026 https://t.co/nr7UuxzmDU""",Olivia,defipinkie,,False,46,156,0,2
2020-10-08 21:30:00,b'Now you can enforce your privacy rights with a single browser tick \\n\\nhttps://t.co/juJgfjsdkC',getspartacus,getspartacus,"California, USA",False,77,222,0,0
2020-10-08 21:29:54,b'Learn how we work with @confluentinc to preserve #DataSecurity and #Privacy for #Data in @apachekafka. Feel confide\\u2026 https://t.co/iPIyPBYFBF',BigID,bigidsecure,"New York, USA",False,1816,884,0,0
2020-10-08 21:29:14,"b'Education Data Privacy and Security Laws | The Harris Beach Podcast | Harris Beach, PLLC - Discover True Engagement https://t.co/09t1fmfL8i'",Michael McDonald,mjmbooboo02,,False,25,133,0,1
2020-10-08 21:25:13,"b'""Yet for other Russian citizens, anonymity on social media is prohibited, there is no medical privacy, there\'s came\\u2026 https://t.co/8J8SEv4j6t'",Khodorkovsky Center,mbk_center,London,False,20716,1284,2,10
2020-10-08 21:25:06,"b'@CryptoNationIN @EarneoDapp Concerning security and customer data, since Earneo is based on the blockchain, how do\\u2026 https://t.co/JyyQwW6F5g'",hakeem kuranga,k2ice,"Lagos,Nigeria",False,19,232,0,0
2020-10-08 21:23:22,"b""I've been working on a project, with data privacy at it's forefront. Just wanted to see if it's worth while before\\u2026 https://t.co/O21c6bPDYi""",❄️,absplash_,"Staten Island, NY",False,289,121,0,2
2020-10-08 21:21:09,b'I feel SM platforms are not doing enough to protect our data privacy that is why sometimes information gets leaked\\u2026 https://t.co/ZTrgeqwGeX',Amarachukwu Nnanna,nnanna_ma,,False,4,7,0,1
2020-10-08 21:20:07,b'tech/data/privacy nerds: do you consider thermal imaging body temperature scanning cameras to be surveillance tech?',RedTail,RedTailAI,"Portland, OR",False,716,505,0,0
2020-10-08 21:19:50,b'@CNN The Health Insurance Portability and Accountability Act of 1996 (HIPAA) guarantees the right to Privacy in hea\\u2026 https://t.co/FlQVcngwpg',Booklover848,LadyBookworm117,,False,58,30,0,0
2020-10-08 21:19:08,"b""Join us Wednesday, Oct 14 at 12 p.m. for #BilzinSumberg's General Counsel's Guide to: Data Privacy. Partners\\u2026 https://t.co/YFqzQBRscZ""",Bilzin Sumberg,BilzinLaw,"Miami, Florida",False,1460,1341,2,2
2020-10-08 21:19:00,b'tech/data/privacy nerds: do you consider thermal imaging body temperature scanning cameras to be surveillance tech?',Kate Kaye,KateKayeReports,"Portland, OR",False,4815,1527,4,22
2020-10-08 21:18:50,"b'If it becomes law, why does the state need to spend money? To create an agency? https://t.co/fLYiUjU9QH'",Isaac “Last Chance” Carter,Isacpotatoes,Ancient Ezzerath,False,179,262,0,0
2020-10-08 21:18:40,"b'Six Reasons You Should Delete WhatsApp...On closer inspection, user privacy and data protection are no longer its p\\u2026 https://t.co/mA93i8xtAE'",Radhika Ramachandran,radhyka,San Francisco Bay Area,False,4185,5234,0,0
2020-10-08 21:18:39,b'Privacy commissioner warns of risks to sensitive data from telemedicine and remote learning\\nhttps://t.co/b0ih7jEcOl',"""Resident Evil"" Origin Story",dblohm7,"Calgary, Alberta",False,392,1408,0,0
2020-10-08 21:18:18,"b'The #CPRA Will Bring New Rights, Responsibilities and Regulators to California Data Privacy Law\\u2026 https://t.co/bSPR1tD9FI'",Womble Bond Dickinson (US) LLP,WBD_US,United States,False,3676,1325,0,1
2020-10-08 21:18:13,b'Students: ProctorTrack is an invasion of my privacy and I won\\u2019t use it.\\n\\nTikTok: Give us all of your data in exchan\\u2026 https://t.co/GiEMKgjpqg',Chris Garland,coachgarland1,"Detroit, MI",False,1812,4614,1,31
2020-10-08 21:16:49,"b'Wygle discusses the lack of control when working with incarcerated populations, as researchers are at the mercy of\\u2026 https://t.co/bFC57kGLcw'",Polis (Duke University),PolisAtDuke,"Durham, NC",False,1173,125,0,0
2020-10-08 21:13:59,b'Article on EEA operation (following CJEU decision on data security in Schrems II).\\nTakeaway points-EEA is its own l\\u2026 https://t.co/rzoqPljBgt',EFTA 4 UK,EFTA4UK,"England, United Kingdom",False,6487,5418,9,21
2020-10-08 21:13:52,"b'You buy a used photocopier. Which has a hard drive. \\n\\nWhich has recorded every scan, copy and fax ever. You see cri\\u2026 https://t.co/q84cCxylaK'",Simon Gibbard,simon_t_gibbard,"Sydney, Australia",False,5543,4096,1,0
2020-10-08 21:13:42,"b""@TheCompanionApp Yes I know, I am a web developer. Just frustrating when a website doesn't work because you decide\\u2026 https://t.co/cIkKD9t7UO""",Philippe 🇨🇦🇪🇺 #StargateNow,Stargayte,"Vancouver, British Columbia",False,338,694,0,0
2020-10-08 21:13:11,b'@sadiestagram The League of Women Voters has a thorough independent analysis here. https://t.co/SCuXuOmdO4',NoOn24CA,NoOn24CA,,False,240,1673,0,0
2020-10-08 21:12:28,b'A government watchdog\\u2019s probe into IRS use of cell phone location data will likely run into legal uncertainty about\\u2026 https://t.co/iBHipvxNL2',Western CPE,westerncpe,"Bozeman, MT",False,2817,2806,0,0
2020-10-08 21:12:11,b'One side: too much platform power = too much data collection = too little privacy + too little competition\\n\\nFlip si\\u2026 https://t.co/0h30JSqw3Y',Sam,DigitalSamIAm,,False,874,703,0,0
2020-10-08 21:10:37,"b'@TheCompanionApp I went through the conditions of Tinypass called Piano now. ""We share your personal data within af\\u2026 https://t.co/avcuMKx5Mm'",Philippe 🇨🇦🇪🇺 #StargateNow,Stargayte,"Vancouver, British Columbia",False,338,694,0,0
2020-10-08 21:07:42,"b'@bsdlp I\'m not saying ""its better than nothing"" I\'m saying is it better than what we have now. This idea of ""all or\\u2026 https://t.co/krqoSiN7xE'",Eric - that Audio guy,Ernst_Blofield,San Diego,False,2338,1118,0,0
2020-10-08 21:05:42,b'Thread and what a search warrant for google data and R. Kelly. \\n\\n#privacy \\n#security \\n#google \\n#rkelly https://t.co/6CYdmNyLKB',Franklin Lee,leefc,"San Francisco, CA",False,96,213,1,1
2020-10-08 21:01:01,b'Now You Can Enforce Your Privacy Rights With A Single Browser Tick\\n\\nFrom the ashes of Do Not Track rises a new Glob\\u2026 https://t.co/rl6atU3XP4',Marsha Collier,MarshaCollier,Los Angeles,True,239928,73317,1,3
2020-10-08 21:00:42,b'Data Privacy Day in is January but you must own your privacy 24/7/365! Update your privacy settings on all your acc\\u2026 https://t.co/hjazRt5NEJ',EKU IT,EKUITColonels,"Richmond, Kentucky",False,2230,2557,0,1
2020-10-08 21:00:12,b'From @CalMatters:\\n\\nIt\\u2019s one of the most confounding fights on California\\u2019s November ballot: Advocates for consumer\\u2026 https://t.co/SvL2PD8QUC',Comstock's magazine,comstocksmag,"Sacramento, CA",False,8294,1710,0,1
2020-10-08 21:00:01,b'The EU-US Privacy Shield ruling has changed how many organizations operate. Our Kris Lovejoy spoke with @RiskMgmt t\\u2026 https://t.co/c8KeqUvYrA',EY Consulting,EY_Consulting,Global,False,8279,426,1,2
2020-10-08 21:00:00,"b'Given that technology has evolved to render us far more interdependent while data flows across the globe, it is hig\\u2026 https://t.co/7NUMYbcwUd'",ORF,orfonline,India,True,79079,142,5,4
2020-10-08 21:00:00,b'Amazon is facing a lawsuit in Germany over claims it has continued to transfer data to the United States using the\\u2026 https://t.co/9FVsewCUrI',POLITICOEurope,POLITICOEurope,Brussels,True,259638,428,18,26
2020-10-08 21:00:00,b'Check it. Tech-publisher coalition backs new push for browser-level privacy controls https://t.co/l6O9jv0bMP via\\u2026 https://t.co/SFuq08mEjF',Kohei Kurihara -DataPrivacy for Fighting Covid-19-,kuriharan,"Tokyo-to, Japan",False,51431,39968,2,6
2020-10-08 20:57:49,b'@cryptowid @Swirgenetwork it is stated in the article that swirge provides a platform for total decentralization th\\u2026 https://t.co/OQYU52cNit',M. zidane👶,Ridho1673,indonesia,False,219,1432,0,0
2020-10-08 20:55:44,b'Morgan Stanley Fined $60 Million in Failed Data-Center Oversight https://t.co/8XcxCKUO6v #business #economy\\u2026 https://t.co/lIrHecAMsa',Tony @ FreeAgent#1,freeagentglobal,"California, USA",False,15251,9128,1,0
2020-10-08 20:54:48,"b""Don't miss the first #PivotbyZL event with @AnnCavoukian! @RUZoneLearning will be exploring the issues around data\\u2026 https://t.co/ttjNR3PLIs""",Transmedia Zone,TransmediaZone,Toronto,False,1636,575,5,2
2020-10-08 20:53:04,"b'@therealfacemelt @social___rocket Now have many super hackers so security, scalability, and data privacy are three\\u2026 https://t.co/zs4rQDL2lQ'",Yahia,noname1mm66,,False,62,229,0,0
2020-10-08 20:52:04,"b""Has 'The Social Dilemma' left you feeling like big tech is out to get you? How much of the documentary is really tr\\u2026 https://t.co/eAXG9s52Z6""",iFocus Marketing,ifocusmktg,"Overland Park, KS",False,374,925,0,0
2020-10-08 20:50:37,"b'Thanks! for those undecided, Please vote NO. I was a coauthor of the CCPA (current law) and Prop 24 undermines our\\u2026 https://t.co/eC5tPQK51p'",Mary Stone Ross,MarySRoss18,,False,525,699,1,2
2020-10-08 20:50:19,"b""I'm super proud to have been part of this global initiative to safely reopen international travel with the privacy\\u2026 https://t.co/V05UrwfwwT""",Mike Godlewski,godmikelewski,San Francisco,False,347,592,0,0
2020-10-08 20:49:08,b'Character and abuse of data privacy laws by sending text messages to random contacts on your contact list.\\u2026 https://t.co/vISx5xuo9K',ENDSARS,douglas_chike,,False,187,323,0,0
2020-10-08 20:48:22,b'@tommamus Prop 24 undermines and weakens protections of the data privacy law the state has already passed. Among ot\\u2026 https://t.co/RmYdOjbUVT',BamBamxxxx,BamBamxx96,"Los Angeles, CA",False,232,98,0,1
